{
  "benchmark": "SPY",
  "cash_vehicle": "BIL",
  "cost": {
    "adverse_bps": 5,
    "bps_1x": 10,
    "bps_2x": 20,
    "partial_fill_per_mille": 80
  },
  "crash_asset": null,
  "eval_window": {
    "end": "2023-12-29",
    "start": "2018-01-02"
  },
  "execution_timing": "NEXT_OPEN",
  "family": "H3_REVERSAL",
  "holdout_window": {
    "end": "2023-12-29",
    "start": "2022-01-03"
  },
  "lookback_days": 5,
  "name": "H3 2-5 day reversal (tiny quota; expected INCONCLUSIVE)",
  "notes": "Buy the two worst 5-session TR names, rebalance every 5 sessions. High turnover plus 10\u201320 bps costs plus adverse/partial fills. Pre-registered expected outcome: INCONCLUSIVE / FAIL after costs. Tiny familywise quota.",
  "params": {},
  "rebalance": "EVERY_N_DAYS",
  "rebalance_n_days": 5,
  "research_window": {
    "end": "2021-12-31",
    "start": "2018-01-02"
  },
  "return_semantic": "TOTAL_RETURN",
  "risk": {
    "kill_drawdown": "0.35",
    "long_only": true,
    "max_gross_exposure": "1.0",
    "max_name_weight": "0.55",
    "unlevered": true,
    "vol_cap": "1.0",
    "vol_lookback_days": 20,
    "vol_target_annual": null
  },
  "risk_assets": [],
  "schema_version": "1.0.0",
  "seed": 42,
  "signal_timing": "PREV_CLOSE",
  "spec_id": "h3-reversal-2to5d-v0",
  "top_k": 2,
  "universe": [
    "SPY",
    "QQQ",
    "IWM",
    "EFA",
    "EEM",
    "VNQ",
    "BIL"
  ],
  "venue": "LOCAL_SIM"
}
